<!ELEMENT intents (intent)*>
<!ELEMENT intent (utterance|matcher)*>
<!ATTLIST intent
        action CDATA #REQUIRED>
<!ELEMENT utterance (#PCDATA)>
<!ELEMENT matcher (#PCDATA)>